Id заявки|Id банкомата|SN банкомата|Тип|Модель|Адреса|Місто|Область|Розташування|Локалізація|Опис заявки|Звіт|Стан заявки|Час створення|Час доступа|Плановий час|Фактичний час|
2944|4572|13-45181328|flm|SelfServ 6626|м. Суми, вул. Петропавлівська, 47|Суми|Сумська|Магазин Художник|Комунікаційне обладнання|Необхідно перевірити мережеве обладнання, зв'язок відсутній. Про результат виконання робіт необхідно звітуватися за номером 0673641820.|Перегрузка комм.оборудования.|Заявка закрита|15.03.2019 14:15:13|15.03.2019 14:30:13|15.03.2019 18:30:00|15.03.2019 16:00:16||
2945|9806|13-41353554|flm|PersonaS 77|м. Новогродівка, вул. 40 років Жовтня, 46|Новогродівка|Донецька|Магазин Росія|Комунікаційне обладнання|Необхідно перевірити мережеве обладнання, зв'язок відсутній. Про результат виконання робіт необхідно звітуватися за номером 0673641820.|Перезагрузка АТМ и сетевого оборудования. АТМ поднят.|Заявка закрита|15.03.2019 14:36:42|15.03.2019 14:51:42|18.03.2019 14:51:00|16.03.2019 17:05:56|18.03.2019 13:51:00|
2946|4026|13-45179948|flm|SelfServ 6626|м. Бердянськ, вул. Шевченкa, 4 (3-й АТМ)|Бердянськ|Запорізька|Відділення Бердянське|Принтер чековий|Необхідно перевірити роботу чекового принтера. Поточний стан: пристрій несправний. M-Status=16. Помилка повторилась від 26.02.2019. Про результат виконання робіт необхідно звітуватися за номером 0673641820.|Убрал застрявший чек. Ещё более расширил щель на лицпанели.|Заявка закрита|15.03.2019 14:36:52|15.03.2019 14:51:52|16.03.2019 10:51:00|18.03.2019 09:30:47|16.03.2019 10:51:00|
2947|2850|13-41378295|flm|PersonaS 77|м. Черкаси, вул. Смілянска, 46|Черкаси|Черкаська|ТОВ КЦУ|Принтер чековий|Необхідна заміна паперу чекового принтера. Про результат виконання робіт необхідно звітуватися за номером 0673641820.|Заменил бумагу в чековом принтере, протестировал, отзвонился координаторам реноме. За бумагой ездил на склад.|Заявка закрита|15.03.2019 15:20:44|15.03.2019 15:35:44|15.03.2019 19:35:00|15.03.2019 19:35:57|15.03.2019 19:35:00|
2948|4614|13-46071492|flm|SelfServ 6622|м. Запоріжжя, вул. Добролюбова, 10|Запоріжжя|Запорізька|Запорізька Державна Інженерна Академія|Принтер чековий|Необхідно перевірити роботу чекового принтера. Поточний стан: пристрій несправний. M-Status=16. Про результат виконання робіт необхідно звітуватися за номером 0673641820.|Устранил замятие чека|Заявка закрита|15.03.2019 15:55:43|15.03.2019 16:10:44|16.03.2019 09:10:00|15.03.2019 18:15:26||
2949|4161|13-45181316|flm|SelfServ 6626|м. Коростень, вул. Грушевського, 42|Коростень|Житомирська|Відділення Коростенське|Комунікаційне обладнання|Необхідно перевірити мережеве обладнання, зв'язок відсутній. Про результат виконання робіт необхідно звітуватися за номером 0673641820.|АТМ заработал|Заявка відхилена|15.03.2019 17:08:05|15.03.2019 17:23:05|19.03.2019 10:00:00||18.03.2019 16:23:00|
2950|9912|13-39662726|flm|PersonaS 77|м. Харків, вул. Гагаріна, 20А|Харків|Харківська|Відділення Харківське №6|Комунікаційне обладнання|Необхідно перевірити мережеве обладнання, зв'язок відсутній. Про результат виконання робіт необхідно звітуватися за номером 0673641820.|Нет доступа к АТМ. Необходима заявка на понедельник 18.03|Заявка відхилена|15.03.2019 18:54:23|15.03.2019 19:09:24||||
2951|4222|13-45167157|flm|SelfServ 6626|м. Київ, пл. Печерська, 1|Київ|Київська|с/м Велика Кишеня|Принтер чековий|Необхідна заміна паперу чекового принтера. Про результат виконання робіт необхідно звітуватися за номером 0673641820.|Замена бумаги чекового принтера.|Заявка закрита|16.03.2019 10:26:19|16.03.2019 10:41:19|16.03.2019 15:41:00|17.03.2019 10:20:57||
2952|9861|13-41353524|flm|PersonaS 77|м. Київ, пров. Красноармійський, 18|Київ|Київська|Київгаз|Комунікаційне обладнання|Необхідно перевірити мережеве обладнання, зв'язок відсутній. Про результат виконання робіт необхідно звітуватися за номером 0673641820.|АТМ заработал|Заявка відхилена|16.03.2019 10:31:48|16.03.2019 10:46:48|16.03.2019 15:46:00|||
2953|4135|13-45179922|flm|SelfServ 6626|м. Костянтинівка, пр. Ломоносова, 99 (2-й АТМ)|Костянтинівка|Донецька|Відділення Костянтинівське|Принтер чековий|Необхідно перевірити роботу чекового принтера. Поточний стан: пристрій несправний. M-Status=16.Логи у вкладенні.  Про результат виконання робіт необхідно звітуватися за номером 0673641820.|Заявку отменили. АТМ заработал.|Заявка відхилена|16.03.2019 12:41:14|18.03.2019 09:00:00|18.03.2019 18:00:00|||
2954|9947|13-41354240|flm|PersonaS 77|м. Бердянськ, пр. Східний, 97|Бердянськ|Запорізька|Бердянськводоканал БМР|Комунікаційне обладнання|Необхідно перевірити мережеве обладнання, зв'язок відсутній. Про результат виконання робіт необхідно звітуватися за номером 0673641820.|АТМ заработал|Заявка відхилена|16.03.2019 13:58:36|18.03.2019 09:00:00|18.03.2019 18:00:00|||
2955|9912|13-39662726|flm|PersonaS 77|м. Харків, вул. Гагаріна, 20А|Харків|Харківська|Відділення Харківське №6|Комунікаційне обладнання|Необхідно перевірити мережеве обладнання, зв'язок відсутній. Про результат виконання робіт необхідно звітуватися за номером 0673641820.|Ложный вызов. Нет доступа к Банкомату. Торговый центр, где установлен АТМ - закрыт. Фото прилагается.|Заявка закрита|17.03.2019 09:30:32|18.03.2019 09:00:00|18.03.2019 13:00:00|18.03.2019 10:35:30||
2956|4442|13-45179926|flm|SelfServ 6626|м. Нововолинськ, бул. Шевченка, 11|Нововолинськ|Волинська|Відділення Нововолинське|Принтер чековий|Необхідно перевірити роботу чекового принтера. Поточний стан: пристрій несправний. M-Status=16. Лог файл додано до заявки. Про результат виконання робіт необхідно звітуватися за номером 0673641820.|АТМ заработал|Заявка відхилена|17.03.2019 13:08:37|18.03.2019 09:00:00|18.03.2019 17:00:00|||
2957|4289|13-48383557|atm repair|SelfServ 6626|м. Чернівці, вул. Незалежності, 89|Чернівці|Чернівецька|Магазин Колос|Принтер чековий|Необхідно перевірити роботу чекового принтера. Поточний стан: пристрій несправний. M-Status=17. Лог файл в заявці. Про результат виконання робіт необхідно звітуватися за номером 0673641820.|Очищен чековый принтер, установлена новая катушка бумаги. Банкомат работает.|Заявка закрита|17.03.2019 15:23:57|18.03.2019 09:00:00|18.03.2019 17:00:00|18.03.2019 19:20:21|18.03.2019 17:00:00|
2958|4609|13-45181299|flm|SelfServ 6626|м. Харків, вул. Полтавський Шлях, 146 (2-й АТМ)|Харків|Харківська|ТЦ Атлас|Принтер чековий|Необхідно перевірити роботу чекового принтера. Поточний стан: пристрій несправний. M-Status=9, 16 та 17. Лог файл додано до заявки. Про результат виконання робіт необхідно звітуватися за номером 0673641820.|Извлечен застрявший чек. Сброс ошибки. Тестовая транзакция с печатью чека.|Заявка закрита|17.03.2019 15:47:52|18.03.2019 09:00:00|18.03.2019 13:00:00|18.03.2019 10:45:48||
2959|4107|13-45179871|flm|SelfServ 6626|м. Чорноморськ, вул. Данченка, 9/80Н (2-й АТМ)|Чорноморськ|Одеська|Відділення Чорноморське|Принтер чековий|Необхідно перевірити роботу чекового принтера. Поточний стан: пристрій несправний. M-Status=17. Лог файл додано до заявки. Про результат виконання робіт необхідно звітуватися за номером 0673641820.|На момент подъезда ошибок по принтеру не было. Проведена чистка принтера, замена бумаги.|Заявка закрита|17.03.2019 16:00:14|18.03.2019 09:00:00|18.03.2019 17:00:00|18.03.2019 10:00:50||
2960|9821|13-41353561|flm|PersonaS 77|м. Одеса, вул. Дворянська, 32|Одеса|Одеська|Одеське училище|Комунікаційне обладнання|Необхідно перевірити мережеве обладнання, зв'язок відсутній. Про результат виконання робіт необхідно звітуватися за номером 0673641820.|Заявку отменили. АТМ заработал.|Заявка відхилена|17.03.2019 17:19:53|18.03.2019 09:00:00|18.03.2019 13:00:00|||
2961|9875|13-41353569|flm|PersonaS 77|м. Київ, пр. Правди, 85|Київ|Київська|Київспецтранс|Комунікаційне обладнання|Необхідно перевірити мережеве обладнання, зв'язок відсутній. Про результат виконання робіт необхідно звітуватися за номером 0673641820.|Перезагрузка АТМ, диагностика.|Заявка закрита|17.03.2019 17:58:50|18.03.2019 09:00:00|18.03.2019 13:00:00|18.03.2019 13:40:30|18.03.2019 13:00:00|
2962|9948|13-41376383|flm|PersonaS 77|м. Луцьк, пр. Волі, 7 (3-й АТМ)|Луцьк|Волинська|Відділення Луцьке|Комунікаційне обладнання|Необхідно перевірити мережеве обладнання, зв'язок відсутній. Про результат виконання робіт необхідно звітуватися за номером 0673641820.|Завісання ПЗ системного блока. Перезавантажив банкомат по живленю. АТМ працює. Повідомив ініціатора заявки про закінчення роботи.|Заявка закрита|18.03.2019 08:00:02|18.03.2019 09:00:00|18.03.2019 13:00:00|18.03.2019 12:05:18|18.03.2019 13:00:00|
2963|4033|13-45179802|flm|SelfServ 6626|м. Львів, вул. Зелена, 204 (2-й АТМ)|Львів|Львівська|Відділення Львівське №11|Принтер чековий|Необхідно перевірити роботу чекового принтера. Поточний стан: пристрій несправний. M-Status=16. Про результат виконання робіт необхідно звітуватися за номером 0673641820.|Чистка датчиків та тестуванея чекового принтера.|Заявка закрита|18.03.2019 09:10:33|18.03.2019 09:25:33|18.03.2019 13:25:00|18.03.2019 13:20:07|18.03.2019 13:25:00|
2964|4442|13-45179926|flm|SelfServ 6626|м. Нововолинськ, бул. Шевченка, 11|Нововолинськ|Волинська|Відділення Нововолинське|Принтер чековий|Необхідно перевірити роботу чекового принтера. Поточний стан: пристрій несправний. M-Status=16. Постійне повторення помилки. Логи у вкладенні. Про результат виконання робіт необхідно звітуватися за номером 0673641820.|Почистив чековий принтер. При тестуванні помилок в роботі принтера не виявлено. Повідомив ініціатору заявки про закіньчення роботи.|Заявка закрита|18.03.2019 09:25:34|18.03.2019 09:40:34|18.03.2019 17:40:00|18.03.2019 14:05:04|18.03.2019 17:40:00|
2965|4358|13-49011432|flm|SelfServ 6622|с. Єлизаветівка, вул. Індустріальна, 9А|Єлизаветівка|Дніпропетровська|Завод Мега Пак|Комунікаційне обладнання|Необхідно перевірити мережеве обладнання, зв'язок відсутній. Про результат виконання робіт необхідно звітуватися за номером 0673641820.|Неуспешно. В здании отсутствует электропитание (ведутся ремонтные работы). Планируемое время включения электропитания - 17:00. Информация передана оператору МЦ RENOME-SMART.|Заявка закрита|18.03.2019 10:45:19|18.03.2019 11:00:19|19.03.2019 10:00:00|18.03.2019 11:10:50||
2966|4570|13-45181309|atm repair|SelfServ 6626|м. Харків, вул. Полтавський Шлях, 155|Харків|Харківська|Магазин ГОССОН|Диспенсер|Необхідно відновити роботу диспенсера. M-Status=18. Логи у вкладені. Банкомат розвантажений. Про результат виконання робіт необхідно звітуватися за номером 0673641820.|Проведена замена присосок, чистка всех дачтиков диспенсера. Проведено тестирование. Сбоев и ошибок в работе нет. Банкомат готов к загрузке.|Заявка закрита|18.03.2019 14:29:57|18.03.2019 14:44:57|19.03.2019 13:44:00|18.03.2019 17:00:02|19.03.2019 13:44:00|
2967|4412|13-45181311|flm|SelfServ 6622|м. Полтава, пр. Першотравневий, 27|Полтава|Полтавська|Гуртожиток № 4 ПНТУ ім.Ю.Кондратюка|Принтер чековий|Необхідно перевірити роботу чекового принтера. Поточний стан: пристрій несправний. M-Status=17. Про результат виконання робіт необхідно звітуватися за номером 0673641820.|По прибытию выявлено ,что ошибок по принтеру нет и принтер работает . Необходимо через несколько дней повторно выставить заявку на профилактику верхней части АТМ. Причина - проведение ремонта здания . система вентиляторов затянула внутрь строительную пыль . Сейчас там работать не удобно и нецелесообразно. Строительные козлы стоят над АТМ . Работы закончатся через несколько дней.Тогда и есть смысл провести чистку верхней части.|Заявка закрита|18.03.2019 15:32:25|18.03.2019 15:47:25|18.03.2019 19:47:00|19.03.2019 11:30:33|18.03.2019 19:47:00|
2968|9859|13-41353526|flm|PersonaS 77|м. Київ, вул. Червонопрапорна, 34|Київ|Київська|ПАТ Корчуватський комбінат будівельних матеріалів|Принтер чековий|Необхідна заміна паперу чекового принтера. Про результат виконання робіт необхідно звітуватися за номером 0673641820.|Замена бумаги чек-принтера, диагностика.|Заявка закрита|18.03.2019 15:53:57|18.03.2019 16:08:57|19.03.2019 08:08:00|19.03.2019 13:00:44|19.03.2019 08:08:00|
2969|2836|13-41376425|flm|PersonaS 77|м. Черкаси, вул. Шевченка, 183|Черкаси|Черкаська|Укртелеком|Комунікаційне обладнання|Необхідно перевірити мережеве обладнання, зв'язок відсутній. Про результат виконання робіт необхідно звітуватися за номером 0673641820.|АТМ заработал|Заявка відхилена|18.03.2019 16:31:57|18.03.2019 16:46:57|19.03.2019 08:46:00|||
2970|4135|13-45179922|flm|SelfServ 6626|м. Костянтинівка, пр. Ломоносова, 99 (2-й АТМ)|Костянтинівка|Донецька|Відділення Костянтинівське|Принтер чековий|Необхідно перевірити роботу чекового принтера. Поточний стан: пристрій несправний. M-Status=16. Про результат виконання робіт необхідно звітуватися за номером 0673641820.|АТМ заработал|Заявка відхилена|18.03.2019 16:34:19|18.03.2019 16:49:20|19.03.2019 15:49:00||19.03.2019 15:49:00|
2971|4063|13-48383099|flm|SelfServ 6626|м. Городок, вул. Грушевського, 80|Городок|Хмельницька|Відділення Городоцьке|Комунікаційне обладнання|Необхідно перевірити мережеве обладнання, зв'язок відсутній. Про результат виконання робіт необхідно звітуватися за номером 0673641820.|АТМ заработал|Заявка відхилена|18.03.2019 17:53:06|18.03.2019 18:08:06|19.03.2019 14:08:00|||
2972|4529|13-45179867|flm|SelfServ 6626|м. Київ, вул. Бориспільська, 9|Київ|Київська|с/м Велика Кишеня|Принтер чековий|Необхідна заміна паперу чекового принтера. Про результат виконання робіт необхідно звітуватися за номером 0673641820.|Замена бумаги в чек-принтере, диагностика.|Заявка закрита|19.03.2019 08:55:52|19.03.2019 09:10:53|19.03.2019 13:10:00|19.03.2019 12:20:15|19.03.2019 13:10:00|
2973|4219|13-45179970|flm|SelfServ 6626|м. Лисичанськ, вул. Шкільна, 4|Лисичанськ|Луганська|Відділення Лисичанське|Системний блок|Необхідно перевірити роботу АТМ, системного блоку. Циклічний ребут. На екрані System Freeze. результат виконання робіт необхідно звітуватися за номером 0673641820.|После отключения электроэнергии (банкомат без ИБП) банкомат перестал загружаться. Вышла из строя ЕРР-клавиатура. Необходима замена, заказал ЕРР-клавиатуру. Отзвонился на мониторинг 0673641820.|Заявка закрита|19.03.2019 09:03:34|19.03.2019 09:18:34|19.03.2019 17:18:00|19.03.2019 14:30:21|19.03.2019 17:18:00|
2974|4289|13-48383557|flm|SelfServ 6626|м. Чернівці, вул. Незалежності, 89|Чернівці|Чернівецька|Магазин Колос|Принтер чековий|Повторно!!!Необхідно перевірити роботу чекового принтера. Поточний стан: пристрій несправний. Помилка повторилась після проведення робіт 19.03.2019 Було очищено чековий принтер, установлена нова катушка бумаги. Логи у вкладенні . Про результат виконання робіт необхідно звітуватися за номером 0673641820.|Повторно очищены сенсоры транспорта чекового принтера, банкомат работает, ошибок нет.|Заявка закрита|19.03.2019 12:39:09|19.03.2019 12:54:10|19.03.2019 16:54:00|19.03.2019 15:00:56|19.03.2019 16:54:00|
2975|9979|13-41376356|flm|PersonaS 77|м. Київ, вул. Рибальська, 22|Київ|Київська|Альфа Страхування|Кардрідер|Необхідно перевірити роботу кардрідера. Поточний стан: за зверненням банку не приймає клієнтські картки. Про результат виконання робіт необхідно звітуватися за номером 0673641820.|Замена ЕРР-клавиатуры. Введены криптоключи. Банкомат проинкассирован. Отзвонился на мониторинг  0673641820.|Заявка закрита|19.03.2019 14:23:55|19.03.2019 14:38:55|20.03.2019 17:39:00|21.03.2019 14:00:56|19.03.2019 18:38:00|
2976|4219|13-45179970|atm repair|SelfServ 6626|м. Лисичанськ, вул. Шкільна, 4|Лисичанськ|Луганська|Відділення Лисичанське|Клавіатура ЕРР|Небхідно виконати заміну EPP клавіатури, за повідомленням сервісного інженера - остання вийшла з ладу. Про результат виконання робіт необхідно звітуватися за номером 0673641820.||Заявка прийнята в роботу|19.03.2019 14:24:15|19.03.2019 14:39:15|20.03.2019 17:39:00||20.03.2019 17:39:00|
2977|2836|13-41376425|flm|PersonaS 77|м. Черкаси, вул. Шевченка, 183|Черкаси|Черкаська|Укртелеком|Комунікаційне обладнання|Необхідно перевірити мережеве обладнання, зв'язок відсутній. Про результат виконання робіт необхідно звітуватися за номером 0673641820.||Заявка прийнята в роботу|19.03.2019 19:21:47|19.03.2019 19:36:47|20.03.2019 11:36:00|||
