Id заявки|Id банкомата|SN банкомата|Тип|Модель|Адреса|Місто|Область|Розташування|Локалізація|Опис заявки|Звіт|Стан заявки|Час створення|Час доступа|Плановий час|Фактичний час|
2810|9932|13-41353873|flm|PersonaS 77|м. Київ, Венеціанський острів, 1|Київ|Київська|Баккара-Плюс|Принтер чековий|Необхідна заміна паперу чекового принтера. Про результат виконання робіт необхідно звітуватися за номером 0673641820.|Установка нового рулона бумаги чекового принтера. Тестирование. Тестовая транзакция с выдачей чека.|Заявка закрита|01.03.2019 08:10:31|01.03.2019 09:00:00|01.03.2019 13:00:00|01.03.2019 12:45:47|01.03.2019 13:00:00|
2811|3754|13-41841789|atm repair|PersonaS 77|м. Львів, вул. Городоцька, 226Б|Львів|Львівська|ПАТ Київстар|Кардрідер|Необхідно провести ремонт кардрідера.Згідно попереднього звіту інженера:необхідно зробити ремонт картрідера з заміною комплектуючих запчастин.  Про результат виконання робіт необхідно звітуватися за номером 0673641820.|Проведено ремонт картрідера замінено направляючі ролики та пасок двигуна. АТМ протестовано на зняття готівки. Реноме проінформовано по телефону.|Заявка закрита|01.03.2019 08:28:29|01.03.2019 09:00:00|01.03.2019 17:00:00|01.03.2019 13:30:25|01.03.2019 17:00:00|
2812|4204|13-45179870|atm repair|SelfServ 6626|м. Ужгород, вул. Минайська, 29А|Ужгород|Закарпатська|Магазин  Євро сезони|Диспенсер|Необхідно відновити роботу диспенсера, необхідна заміна ременів диспенсера.  Банкомат розвантажений. Про результат виконання робіт необхідно звітуватися за номером 0673641820.|Установили полностью реставрированный диспенсер на банкомат. Дождались инкассаторов, заинкассировали банкомат, повторно обучили банкомат на купюры. Итог-банкомат в работе. В Реноме отзвонились.|Заявка закрита|01.03.2019 09:58:49|01.03.2019 10:13:49|04.03.2019 09:13:00|04.03.2019 13:00:40|04.03.2019 09:13:00|
2813|4596|13-45179885|flm|SelfServ 6626|м. Фастів, вул. Соборна, 36|Фастів|Київська|Аптека|Комунікаційне обладнання|Необхідно перевірити мережеве обладнання, зв'язок відсутній. Про результат виконання робіт необхідно звітуватися за номером 0673641820.|АТМ заработал|Заявка відхилена|01.03.2019 10:37:16|01.03.2019 10:52:16|01.03.2019 18:52:00|||
2814|4289|13-48383557|flm|SelfServ 6626|м. Чернівці, вул. Незалежності, 89|Чернівці|Чернівецька|Магазин Колос|Принтер чековий|Необхідно перевірити роботу чекового принтера. Поточний стан: пристрій несправний. M-Status=16. Про результат виконання робіт необхідно звітуватися за номером 0673641820.|Очищены сенсоры, проведены тесты чекового принтера. Банкомат работает.|Заявка закрита|01.03.2019 13:11:41|01.03.2019 13:26:41|01.03.2019 17:26:00|01.03.2019 15:15:58||
2815|4593|13-45179869|flm|SelfServ 6626|м. Київ, пр. Маяковського, 10|Київ|Київська|НАСК Оранта|Принтер чековий|Необхідна заміна паперу чекового принтера.Отримано інформацію від служби інкасації: папір закінчився. Про результат виконання робіт необхідно звітуватися за номером 0673641820.|Замена бумаги.|Заявка закрита|01.03.2019 13:16:47|01.03.2019 13:31:48|01.03.2019 17:31:00|04.03.2019 12:30:54|01.03.2019 17:31:00|
2816|9886|13-41353556|flm|PersonaS 77|м. Гірське, вул. Куйбишева, 21|Гірське|Луганська|Шахта Гірська|Принтер чековий|Необхідна заміна паперу чекового принтера. Про результат виконання робіт необхідно звітуватися за номером 0673641820.|Замена бумаги, отзвонился на мониторинг 0673641820.|Заявка закрита|01.03.2019 15:05:57|01.03.2019 15:20:57|02.03.2019 11:20:00|02.03.2019 10:50:28|02.03.2019 11:20:00|
2817|9952|13-41376435|flm|PersonaS 77|м. Чернігів, пр. Перемоги, 62 (2-й АТМ)|Чернігів|Чернігівська|Відділення Чернігівське|Принтер чековий|Необхідна заміна паперу чекового принтера. Про результат виконання робіт необхідно звітуватися за номером 0673641820.|Замена бумаги, тестирование.|Заявка закрита|01.03.2019 16:10:21|01.03.2019 16:25:21|02.03.2019 08:25:00|02.03.2019 09:10:47|02.03.2019 08:25:00|
2818|9996|13-41376394|flm|PersonaS 77|с. Нижнє Солотвино, 226|Нижнє Солотвино|Закарпатська|ТЗОВ Термал-Стар|Комунікаційне обладнання|Необхідно перевірити мережеве обладнання, зв'язок відсутній. Про результат виконання робіт необхідно звітуватися за номером 0673641820.||Заявка відхилена|01.03.2019 19:17:26|04.03.2019 09:00:26|04.03.2019 17:00:00||04.03.2019 17:00:26|
2819|9821|13-41353561|flm|PersonaS 77|м. Одеса, вул. Дворянська, 32|Одеса|Одеська|Одеське училище|Комунікаційне обладнання|Необхідно перевірити мережеве обладнання, зв'язок відсутній. Про результат виконання робіт необхідно звітуватися за номером 0673641820.||Заявка відхилена|01.03.2019 19:26:16|04.03.2019 09:00:17|04.03.2019 13:00:00||04.03.2019 13:00:17|
2820|4387|13-45179893|flm|SelfServ 6626|м. Знам'янка, вул. Калініна, 118Д|Знам'янка|Кіровоградська|Магазин Серебро|Принтер чековий|Необхідно перевірити роботу чекового принтера. Поточний стан: пристрій несправний. M-Status=16. Про результат виконання робіт необхідно звітуватися за номером 0673641820.||Заявка відхилена|02.03.2019 09:52:48|04.03.2019 09:00:00|04.03.2019 17:00:00|||
2821|4440|13-45179971|flm|SelfServ 6626|м. Чудей, вул. Карпатська, 1|Чудей|Чернівецька|Магазин|Комунікаційне обладнання|Необхідно перевірити мережеве обладнання, зв'язок відсутній. Про результат виконання робіт необхідно звітуватися за номером 0673641820.|Перезагружен атм и оборудование связи. Атм включен после прохождения теста ИБП (разряжен). Банкомат работает.|Заявка закрита|02.03.2019 13:53:00|04.03.2019 09:00:00|04.03.2019 17:00:00|04.03.2019 15:00:30|04.03.2019 17:00:00|
2822|4063|13-48383099|flm|SelfServ 6626|м. Городок, вул. Грушевського, 80|Городок|Хмельницька|Відділення Городоцьке|Принтер чековий|Необхідна заміна паперу чекового принтера. Про результат виконання робіт необхідно звітуватися за номером 0673641820.|Замінено термопапір, залишено додатково один рулон. Моніторинг повідомлено.|Заявка закрита|02.03.2019 16:14:04|04.03.2019 09:00:00|04.03.2019 17:00:00|04.03.2019 13:30:10|04.03.2019 17:00:00|
2823|9875|13-41353569|flm|PersonaS 77|м. Київ, пр. Правди, 85|Київ|Київська|Київспецтранс|Комунікаційне обладнання|Необхідно перевірити мережеве обладнання, зв'язок відсутній. Про результат виконання робіт необхідно звітуватися за номером 0673641820.|АТМ зарбаотал|Заявка відхилена|02.03.2019 16:58:02|04.03.2019 09:00:00|04.03.2019 13:00:00||04.03.2019 13:00:00|
2824|4360|13-52671498|flm|SelfServ 6626|м. Коростень, вул. Каштанова, 3|Коростень|Житомирська|ТОВ Коростенський щебзавод|Комунікаційне обладнання|Необхідно перевірити мережеве обладнання, зв'язок відсутній. Про результат виконання робіт необхідно звітуватися за номером 0673641820.||Заявка відхилена|03.03.2019 10:00:18|04.03.2019 09:00:18|04.03.2019 17:00:00|||
2825|4208|13-45179868|flm|SelfServ 6626|м. Одеса, вул. Люстдорфська дорога, 5|Одеса|Одеська|Бізнес-центр|Комунікаційне обладнання|Необхідно перевірити мережеве обладнання, зв'язок відсутній. Про результат виконання робіт необхідно звітуватися за номером 0673641820.|Нет света.|Заявка закрита|04.03.2019 08:58:34|04.03.2019 09:13:34|04.03.2019 13:13:00|04.03.2019 09:50:12||
2826|4067|13-45179962|atm repair|SelfServ 6626|м. Нікополь, пр. Трубників, 11А (2-й АТМ)|Нікополь|Дніпропетровська|Відділення Нікопольське|Диспенсер|Необхідно відновити роботу диспенсера. M-Status=18. Логи у вкладені. Доступ до АТМ по прибутті. Про результат виконання робіт необхідно звітуватися за номером 0673641820.|Заменена сдвоенная шестерня, чистка датчиков, тестирование. Готов к загрузке.|Заявка закрита|04.03.2019 09:10:14|04.03.2019 09:25:14|05.03.2019 12:25:00|04.03.2019 12:00:16|05.03.2019 12:25:00|
2827|9889|13-39729932|flm|PersonaS 87|м. Одеса, вул. Катерининська, 11 (2-й АТМ)|Одеса|Одеська|Відділення Одеське|Принтер чековий|Необхідно перевірити роботу чекового принтера. Поточний стан: пристрій несправний. M-Status=16. Про результат виконання робіт необхідно звітуватися за номером 0673641820.|Извлечен застрявший чек.|Заявка закрита|04.03.2019 09:36:19|04.03.2019 09:51:19|04.03.2019 13:51:00|04.03.2019 10:30:38||
2828|4140|13-52671501|flm|SelfServ 6626|м. Одеса, вул. Генерала Бочарова, 40 (2-й АТМ)|Одеса|Одеська|Відділення Одеське №13|Принтер чековий|Необхідна заміна паперу чекового принтера. Про результат виконання робіт необхідно звітуватися за номером 0673641820.|Замена бумаги.|Заявка закрита|04.03.2019 11:54:59|04.03.2019 12:09:59|04.03.2019 16:09:00|04.03.2019 15:15:13|04.03.2019 16:09:00|
2829|9806|13-41353554|flm|PersonaS 77|м. Новогродівка, вул. 40 років Жовтня, 46|Новогродівка|Донецька|Магазин Росія|Кардрідер|Необхідно перевірити роботу кардрідера, провести тестову транзакцію. Тривалий час відутні транзакції, отримано інформаціб від банку: присутня помилка по кардрідеру. Логи у вкладенні. Про результат виконання робіт необхідно звітуватися за номером 0673641820.|Выполнен сброс ошибки картридера. Тестирование. Необходима ремонтная заявка.(уже создана).|Заявка закрита|04.03.2019 16:20:30|04.03.2019 16:35:31|05.03.2019 15:35:00|05.03.2019 10:25:47|05.03.2019 15:35:00|
2830|9821|13-41353561|flm|PersonaS 77|м. Одеса, вул. Дворянська, 32|Одеса|Одеська|Одеське училище|Лицева панель|Згідно звернення від банку необхідно впорядкувати та прибрати провода які звисають із АТМ:провода от банкомата свисают со всех сторон и вокруг банкомата.  На прохання банку роботи необхідно виконати до 05.03. до 13:00. Про результат виконання робіт необхідно звітуватися за номером 0673641820.|Требуется установка сетевого удлинителя 220В ( 1,8 м ) Ожидаем заявку с гарантией оплаты.|Заявка закрита|04.03.2019 18:32:49|05.03.2019 09:00:00|05.03.2019 13:00:00|04.03.2019 18:45:30||
2831|9821|13-41353561|flm|PersonaS 77|м. Одеса, вул. Дворянська, 32|Одеса|Одеська|Одеське училище|Лицева панель|Згідно звернення від банку необхідно впорядкувати та прибрати провода які звисають із АТМ:провода от банкомата свисают со всех сторон и вокруг банкомата.  На прохання банку роботи необхідно виконати до 05.03. до 13:00. Банк оплату подовжувача та виїзд інженера гарантує. Про результат виконання робіт необхідно звітуватися за номером 0673641820.|Осмотр АТМ, установка удленителя. Кабели не свисали вокруг банкомата.  Фотографии прилагаются.|Заявка закрита|05.03.2019 09:35:31|05.03.2019 09:50:31|05.03.2019 13:50:00|05.03.2019 11:55:35|05.03.2019 13:50:00|
2832|4116|13-45179896|flm|SelfServ 6626|м. Одеса, вул. Середня, 83А (2-й АТМ)|Одеса|Одеська|Відділення Балківське|Принтер чековий|Необхідно перевірити роботу чекового принтера. Поточний стан: пристрій несправний. M-Status=16. Логи у вкладенні. Про результат виконання робіт необхідно звітуватися за номером 0673641820.|Замена бумаги чекового принтера.|Заявка закрита|05.03.2019 10:27:22|05.03.2019 10:42:22|05.03.2019 14:42:00|05.03.2019 12:20:40|05.03.2019 14:42:00|
2833|9806|13-41353554|atm repair|PersonaS 77|м. Новогродівка, вул. 40 років Жовтня, 46|Новогродівка|Донецька|Магазин Росія|Кардрідер|Відновлення роботи кардрідера. Розбірка та повна чистка кардрідера. РОботи вже виконані  Василем Кравченком|Выполнена чиска картридера с полной разборкой. Очень грязный. В помещении где стоит АТМ проводятся строительные работы. Тестирование картридера (ок). АТМ в сервисе.|Заявка закрита|05.03.2019 10:51:08|05.03.2019 11:06:08|06.03.2019 14:06:00|05.03.2019 10:55:54|06.03.2019 14:06:00|
2834|4608|13-45179906|atm repair|SelfServ 6626|м. Вільнянськ, вул. Бочарова, 4|Вільнянськ|Запорізька|Вільнянська міська рада|Принтер чековий|Необхідно виконати заміну чекового принтера. Постійні помилки M-Status 17.  Про результат виконання робіт необхідно звітуватися за номером 0673641820.|Заменен принтер и бумага.|Заявка закрита|05.03.2019 11:29:45|05.03.2019 11:44:45|06.03.2019 14:44:00|05.03.2019 17:20:26|06.03.2019 14:44:00|
2835|4122|13-45181304|atm repair|SelfServ 6626|м. Харків, вул. Гоголя, 10 (3-й АТМ)|Харків|Харківська|Відділення Харківське|Диспенсер|Необхідно відновити роботу диспенсера. M-Status=12. Логи у вкладені. Банкомат розвантажений. Про результат виконання робіт необхідно звітуватися за номером 0673641820.|Произведена чистка датчиков презентера. Клэмп установлен в рабочее положение.|Заявка закрита|05.03.2019 12:07:03|05.03.2019 12:22:03|06.03.2019 11:22:00|05.03.2019 16:00:13|06.03.2019 11:22:00|
2836|4389|13-45179880|flm|SelfServ 6626|м. Лисичанськ, пр. Перемоги, 80|Лисичанськ|Луганська|Магазин Абсолют|Комунікаційне обладнання|Необхідно перевірити мережеве обладнання, зв'язок відсутній. Про результат виконання робіт необхідно звітуватися за номером 0673641820.|АТМ заработал|Заявка відхилена|05.03.2019 13:04:37|05.03.2019 13:19:38|06.03.2019 09:19:00||06.03.2019 09:19:00|
2837|4219|13-45179970|flm|SelfServ 6626|м. Лисичанськ, вул. Шкільна, 4|Лисичанськ|Луганська|Відділення Лисичанське|Комунікаційне обладнання|Необхідно перевірити мережеве обладнання, зв'язок відсутній. Про результат виконання робіт необхідно звітуватися за номером 0673641820.|||05.03.2019 13:09:12|05.03.2019 13:24:12|||05.03.2019 21:24:12|
2838|4219|13-45179970|flm|SelfServ 6626|м. Лисичанськ, вул. Шкільна, 4|Лисичанськ|Луганська|Відділення Лисичанське|Комунікаційне обладнання|Необхідно перевірити мережеве обладнання, зв'язок відсутній. Про результат виконання робіт необхідно звітуватися за номером 0673641820.|АТМ заработал|Заявка відхилена|05.03.2019 13:18:29|05.03.2019 13:33:29|06.03.2019 09:33:00||06.03.2019 09:33:00|
2839|9960|13-41354246|flm|PersonaS 77|м. Новогродівка, вул. 40 років Жовтня, 36|Новогродівка|Донецька|Магазин Центральний|Комунікаційне обладнання|Необхідно перевірити мережеве обладнання, зв'язок відсутній. Про результат виконання робіт необхідно звітуватися за номером 0673641820.|Созвон с магазином где расположен АТМ. В помещении частые отключения эл. снабжения.|Заявка закрита|05.03.2019 14:48:32|05.03.2019 15:03:32|06.03.2019 14:03:00|05.03.2019 17:35:53|06.03.2019 13:03:00|
2840|9876|13-40681832|flm|PersonaS 77|м. Київ, вул. Білицька, 45|Київ|Київська|Київгаз|Принтер чековий|Необхідно перевірити роботу чекового принтера. Поточний стан: пристрій несправний. M-Status=. Про результат виконання робіт необхідно звітуватися за номером 0673641820.|Замятие бумаги. Сброс ошибок.|Заявка закрита|06.03.2019 08:01:52|06.03.2019 08:16:52|06.03.2019 12:16:00|06.03.2019 12:25:13|06.03.2019 12:16:00|
2841|9978|13-41376413|flm|PersonaS 77|м. Краматорськ, вул. Ордженикидзе, 5 (2-й АТМ)|Краматорськ|Донецька|ПАТ НКМЗ|Кардрідер|Необхідно перевірити роботу кардрідера. Поточний стан: пристрій несправний. M-Status=27, 13, 16, 20. Про результат виконання робіт необхідно звітуватися за номером 0673641820.|Извлек бумажный чек из кардридера, протер ролики. Тестирование.|Заявка закрита|06.03.2019 08:03:19|06.03.2019 08:18:19|06.03.2019 17:00:00|06.03.2019 15:40:20|06.03.2019 17:00:00|
2842|4570|13-45181309|flm|SelfServ 6626|м. Харків, вул. Полтавський Шлях, 155|Харків|Харківська|Магазин ГОССОН|Кардрідер|Необхідно перевірити роботу кардрідера. Поточний стан:пристрій несправний. M-Status=11/13. Про результат виконання робіт необхідно звітуватися за номером 0673641820.|Вандализм. Из карт-ридера извлечен посторонний предмет. Сброс ошибки, тестирование. Фотографии прилагаются.|Заявка закрита|06.03.2019 09:06:51|06.03.2019 09:21:51|06.03.2019 13:21:00|06.03.2019 11:30:01|06.03.2019 13:21:00|
2843|4570|13-45181309|flm|SelfServ 6626|м. Харків, вул. Полтавський Шлях, 155|Харків|Харківська|Магазин ГОССОН|Кардрідер|Необхідно перевірити роботу кардрідера. Поточний стан: пристрій несправний. M-Status=11, 13, 16, 20. Про результат виконання робіт необхідно звітуватися за номером 0673641820.|Заявка дана повторно.|Заявка відхилена|06.03.2019 09:10:04|06.03.2019 09:25:04||||
2844|4117|13-45179912|flm|SelfServ 6626|м. Житомир, вул. Перемоги, 7А (3-й АТМ)|Житомир|Житомирська|Відділення Житомирське|Принтер чековий|Необхідна заміна паперу чекового принтера. Про результат виконання робіт необхідно звітуватися за номером 0673641820.|АТМ запущен в работу.|Заявка закрита|06.03.2019 10:39:32|06.03.2019 10:54:32|06.03.2019 14:54:00|06.03.2019 09:00:02|06.03.2019 14:54:00|
2845|4381|13-45167159|flm|SelfServ 6622|с. Яснозір'я, вул. Центральна, 82|Яснозір'я|Черкаська|ТОВ Верес|Комунікаційне обладнання|Необхідно перевірити мережеве обладнання, зв'язок відсутній. Про результат виконання робіт необхідно звітуватися за номером 0673641820.|АТМ заработал|Заявка відхилена|06.03.2019 11:24:37|06.03.2019 11:39:37|06.03.2019 19:39:00||06.03.2019 19:39:00|
