Id заявки|Id банкомата|SN банкомата|Тип|Модель|Адреса|Місто|Область|Розташування|Локалізація|Опис заявки|Звіт|Стан заявки|Час створення|Час доступа|Плановий час|Фактичний час|
2880|4411|13-45179916|atm repair|SelfServ 6622|м. Запоріжжя, вул. Сталеварів, 31А|Запоріжжя|Запорізька|Відділення Медичне|Диспенсер|Необхідно відновити роботу диспенсера. Проблеми з 3 пікером. M-Status=1,3. Логи у вкладені. Банкомат розвантажений. Про результат виконання робіт необхідно звітуватися за номером 0673641820.|Сейф атм закрыт.|Заявка закрита|11.03.2019 11:30:50|11.03.2019 11:45:50|12.03.2019 10:45:00|11.03.2019 12:00:41||
2881|9810|13-41353508|flm|PersonaS 77|м. Київ, вул. Баренбойма, 1|Київ|Київська|Приватне акціонерне товариство УГМК|Комунікаційне обладнання|Необхідно перевірити мережеве обладнання, зв'язок відсутній. Про результат виконання робіт необхідно звітуватися за номером 0673641820.|Ложный вызов. АТМ работает.|Заявка закрита|11.03.2019 11:41:03|11.03.2019 11:56:03|11.03.2019 15:56:00|11.03.2019 13:30:55||
2882|4063|13-48383099|flm|SelfServ 6626|м. Городок, вул. Грушевського, 80|Городок|Хмельницька|Відділення Городоцьке|Комунікаційне обладнання|Необхідно перевірити мережеве обладнання, зв'язок відсутній. Про результат виконання робіт необхідно звітуватися за номером 0673641820.|Атм заработал|Заявка відхилена|11.03.2019 11:41:47|11.03.2019 11:56:47|11.03.2019 19:56:00|||
2883|4533|13-46071490|flm|SelfServ 6622|м. Краматорськ, пр. Дворцовий, 23|Краматорськ|Донецька|Магазин Брусниця|Принтер чековий|Необхідно перевірити роботу чекового принтера. Поточний стан: пристрій несправний. M-Status=16. Логи у вкладенні. Про результат виконання робіт необхідно звітуватися за номером 0673641820.|Ошибок по принтеру нет. Тестирование принтера. АТМ поднят.|Заявка закрита|11.03.2019 12:12:39|11.03.2019 12:27:40|12.03.2019 08:27:00|12.03.2019 10:45:47|12.03.2019 08:27:00|
2884|4302|13-51991097|flm|SelfServ 6626|м. Київ, вул. Братиславська, 11 (3-й АТМ)|Київ|Київська|г/м Епіцентр|Комунікаційне обладнання|Необхідно перевірити мережеве обладнання, на АТМ повторно втрачено зв'язок. Про результат виконання робіт необхідно звітуватися за номером 0673641820.||Заявка прийнята в роботу|11.03.2019 12:24:49|11.03.2019 12:39:49|11.03.2019 16:39:00||11.03.2019 16:39:00|
2885|4249|13-45179884|flm|SelfServ 6626|м. Хуст, вул. Карпатської Січі, 26|Хуст|Закарпатська|Магазин Second Hand|Принтер чековий|Необхідно перевірити роботу чекового принтера. Поточний стан: пристрій несправний. M-Status=17, 16. Логи у вкладенні. Про результат виконання робіт необхідно звітуватися за номером 0673641820.|Извлек застрявшую бумагу из чекового принтера. Сбросил ошибку по чековому принтеру-чековый принтер заработал. В Реноме отзвонился.|Заявка закрита|11.03.2019 12:31:11|11.03.2019 12:46:11|13.03.2019 08:46:00|11.03.2019 15:15:24||
2886|4399|13-45179939|flm|SelfServ 6626|с. Литвинець, вул. Грибна, 1|Литвинець|Черкаська|Верес|Принтер чековий|Необхідно перевірити роботу чекового принтера. Поточний стан: пристрій несправний. M-Status=17. Логи у вкладенні. Про результат виконання робіт необхідно звітуватися за номером 0673641820.|Когда даете ошибки устройства, просьба давать заявки на ремонт, а не давать flm, ложный вызов, необходимо заявка на ремонт давать!!!!!!!!!!!!!!!!!!!!!!! Дайте заявку на ремонт.|Заявка закрита|11.03.2019 14:23:50|11.03.2019 14:38:50|12.03.2019 10:38:00|12.03.2019 12:25:41|12.03.2019 10:38:00|
2887|4607|13-45179954|atm repair|SelfServ 6626|м. Кам'янське, пр. Свободи, 1|Кам'янське|Дніпропетровська|ТОВ Дніпровський металургійний комбінат|Диспенсер|Необхідно відновити роботу диспенсера. M-Status=14, при тесті не відкривається шаттер. Логи у вкладені. Банкомат розвантажений. Про результат виконання робіт необхідно звітуватися за номером 0673641820.|||11.03.2019 14:24:08|11.03.2019 14:39:08|||12.03.2019 17:39:00|
2888|4328|13-45179940|atm repair|SelfServ 6626|м. Нікополь, вул. Дружби, 2|Нікополь|Дніпропетровська|Магазин Кафель-Сантехника|Диспенсер|Небхідно виконати 13.03.2019 сумісний виїзд з СІ для відновлення роботи касового модуля та усунення затиснення готівки . Контактна особа 067 3342716 набрати о 9:00 Про результат виконання робіт необхідно звітуватися за номером 0673641820.|Необходимо согласование с банком|Заявка відхилена|11.03.2019 14:43:02|13.03.2019 11:00:00||||
2889|4183|13-45179894|atm repair|SelfServ 6626|м. Черкаси, бул. Шевченка, 398|Черкаси|Черкаська|Магазин Обнова|Диспенсер|Необхідно відновити роботу диспенсера. M-Status=5. Логи у вкладені. Банкомат розвантажений. Про результат виконання робіт необхідно звітуватися за номером 0673641820.|Чистка механизмов и датчиков диспенсера, промыл присоски, проверка синхронизации, тестирование.|Заявка закрита|11.03.2019 14:46:26|11.03.2019 15:01:26|12.03.2019 14:01:00|11.03.2019 16:50:03|12.03.2019 14:01:00|
2890|4381|13-45167159|flm|SelfServ 6622|с. Яснозір'я, вул. Центральна, 82|Яснозір'я|Черкаська|ТОВ Верес|Комунікаційне обладнання|Необхідно перевірити мережеве обладнання, зв'язок відсутній. Про результат виконання робіт необхідно звітуватися за номером 0673641820.|Просьба уточнить у владельца помещения есть ли 220 В, у провайдера наличие напряжения на их оборудования, вчера был сильный ветер, может быть обрыв линии, по дороге валялись ветки и деревья, а потом повторно дать заявку.|Заявка закрита|11.03.2019 14:47:44|11.03.2019 15:02:44|12.03.2019 11:02:00|11.03.2019 16:10:12|12.03.2019 11:02:00|
2891|4624|13-45167141|flm|SelfServ 6622|м. Одеса, вул. Вільямса, 9А|Одеса|Одеська|с/м Таврія В|Принтер чековий|Необхідна заміна паперу чекового принтера. Про результат виконання робіт необхідно звітуватися за номером 0673641820.|Замена бумаги чекового принтера|Заявка закрита|11.03.2019 16:04:41|11.03.2019 16:19:41|12.03.2019 08:19:00|12.03.2019 08:55:54|12.03.2019 08:19:00|
2892|4328|13-45179940|atm repair|SelfServ 6626|м. Нікополь, вул. Дружби, 2|Нікополь|Дніпропетровська|Магазин Кафель-Сантехника|Диспенсер|Небхідно виконати 13.03.2019 сумісний виїзд з СІ для відновлення роботи касового модуля та усунення затиснення готівки . Контактна особа 067 3342716 набрати о 9:00 Про результат виконання робіт необхідно звітуватися за номером 0673641820|Заявка на совместнй подъезд возможно при необходимости. На данный момент необходимости такой нет|Заявка відхилена|11.03.2019 16:06:16|13.03.2019 11:00:00||||
2893|4122|13-45181304|atm repair|SelfServ 6626|м. Харків, вул. Гоголя, 10 (3-й АТМ)|Харків|Харківська|Відділення Харківське|Диспенсер|Необхідно відновити роботу диспенсера. M-Status=1, 5, 7, 11. Підчас проведення інкасації постійні затискання готівки. Логи у вкладені. Банкомат розвантажений. Про результат виконання робіт необхідно звітуватися за номером 0673641820.|На момент подъезда к банкомату, ошибок по диспенсору нет.|Заявка закрита|11.03.2019 17:02:46|11.03.2019 17:17:46|12.03.2019 16:17:00|12.03.2019 11:30:48|12.03.2019 16:17:00|
2894|9988|13-41376403|flm|PersonaS 77|м. Новогродівка, вул. Степова, 1 (2-й АТМ)|Новогродівка|Донецька|ГП Селидіввугілля|Комунікаційне обладнання|Необхідно перевірити мережеве обладнання, зв'язок відсутній. Про результат виконання робіт необхідно звітуватися за номером 0673641820.|АТМ заработал|Заявка відхилена|11.03.2019 17:37:46|11.03.2019 17:40:46|12.03.2019 16:40:00||12.03.2019 16:40:00|
2895|4048|13-45179932|flm|SelfServ 6626|м. Івано-Франківськ, вул. Незалежності, 44 (2-й АТМ)|Івано-Франківськ|Івано-Франківська|Відділення Івано-Франківське|Принтер чековий|Необхідна заміна паперу чекового принтера. Про результат виконання робіт необхідно звітуватися за номером 0673641820.|Заміна бумаги. Прохання в нових заявках вказувати номер телефону людини яка може зняти банкомат з охорони, або надати сервісний код сигналізації.|Заявка закрита|11.03.2019 17:43:45|11.03.2019 17:58:45|12.03.2019 09:58:00|12.03.2019 14:00:56|12.03.2019 09:58:00|
2896|4328|13-45179940|atm repair|SelfServ 6626|м. Нікополь, вул. Дружби, 2|Нікополь|Дніпропетровська|Магазин Кафель-Сантехника|Диспенсер|Необхідний сумісний виїзд із СІ при виявленні проблем в роботі касового модуля під час проведення процесу інкасації служюбою інкасації. Контактна особа 067 3342716. Із банком  узгоджено. Про результат виконання робіт звітуватися за номером 0673641820|ТО дистпенсера, чистка датчиков, замена присосок, втулок. тестирование. Оператор МЦ RENOME-SMART оповещен.|Заявка закрита|11.03.2019 18:21:46|13.03.2019 13:00:00|14.03.2019 16:00:00|13.03.2019 13:00:33|14.03.2019 16:00:00|
2897|9821|13-41353561|flm|PersonaS 77|м. Одеса, вул. Дворянська, 32|Одеса|Одеська|Одеське училище|Принтер чековий|Необхідно перевірити роботу чекового принтера. Поточний стан: пристрій несправний. M-Status=16. Логи у вкладенні. Про результат виконання робіт необхідно звітуватися за номером 0673641820.|Изьятие застрявшего чека,  сброс ошибок по принтеру.|Заявка закрита|11.03.2019 18:31:04|12.03.2019 09:00:00|12.03.2019 13:00:00|12.03.2019 12:40:26|12.03.2019 13:00:00|
2898|9812|13-41353869|flm|PersonaS 77|м. Черкаси, пр. Хіміків, 76|Черкаси|Черкаська|Черкаське хімволокно|Принтер чековий|Необхідно перевірити роботу чекового принтера. Поточний стан: пристрій несправний. M-Status=16. Логи у вкладенні. Про результат виконання робіт необхідно звітуватися за номером 0673641820.|Ложный вызов, к банкомату не пустили. Списков на проходной нет. Прошу списки сколько обслуживаем банк.|Заявка закрита|11.03.2019 19:07:44|12.03.2019 09:00:00|12.03.2019 13:00:00|12.03.2019 10:10:15|12.03.2019 13:00:00|
2899|2836|13-41376425|flm|PersonaS 77|м. Черкаси, вул. Шевченка, 183|Черкаси|Черкаська|Укртелеком|Комунікаційне обладнання|Необхідно перевірити мережеве обладнання, зв'язок відсутній. Про результат виконання робіт необхідно звітуватися за номером 0673641820.|Заявку отменили. АТМ заработал.|Заявка відхилена|11.03.2019 19:32:31|12.03.2019 09:00:00|12.03.2019 13:00:00|||
2900|9875|13-41353569|flm|PersonaS 77|м. Київ, пр. Правди, 85|Київ|Київська|Київспецтранс|Комунікаційне обладнання|Необхідно перевірити мережеве обладнання, зв'язок відсутній. Про результат виконання робіт необхідно звітуватися за номером 0673641820.|На черном екране сообщение MDSW-01-MODESWITCH.  Перезагрузка по питанию.|Заявка закрита|12.03.2019 08:22:02|12.03.2019 09:00:00|12.03.2019 13:00:00|12.03.2019 17:15:00|12.03.2019 13:00:00|
2901|9812|13-41353869|flm|PersonaS 77|м. Черкаси, пр. Хіміків, 76|Черкаси|Черкаська|Черкаське хімволокно|Принтер чековий|Необхідно перевірити роботу чекового принтера. Поточний стан: пристрій несправний. M-Status=16. Отримано інформацію від банку: для доступу до АТМ за півгодини до виїзду на АТМ необхідно телефонувати до к.о. Швыдченко Елена 0673266489. Про результат виконання робіт необхідно звітуватися за номером 0673641820.|Заявка дана повторно.|Заявка відхилена|12.03.2019 10:32:37|12.03.2019 10:47:37||||
2902|9988|13-41376403|flm|PersonaS 77|м. Новогродівка, вул. Степова, 1 (2-й АТМ)|Новогродівка|Донецька|ГП Селидіввугілля|Комунікаційне обладнання|ПОВТОРНО. Необхідно перевірити мережеве обладнання, постійно АТМ втрачає звязок. Необхідно перезавантажити МО, АТМ. Про результат виконання робіт необхідно звітуватися за номером 0673641820.|Выполнена перезагрузка коммуникационного оборудования и АТМ по питанию. Антена роутера переставлена поближе к окну. АТМ в сервисе. Про результат виконання робіт  звітувано за номером 0673641820.|Заявка закрита|12.03.2019 10:42:43|12.03.2019 10:57:43|13.03.2019 09:57:00|12.03.2019 14:15:25|13.03.2019 09:57:00|
2903|9988|13-41376403|flm|PersonaS 77|м. Новогродівка, вул. Степова, 1 (2-й АТМ)|Новогродівка|Донецька|ГП Селидіввугілля|Комунікаційне обладнання|ПОВТОРНО. Необхідно перевірити мережеве обладнання, постійно АТМ втрачає звязок. Необхідно перезавантажити МО, АТМ. Про результат виконання робіт необхідно звітуватися за номером 0673641820.|||12.03.2019 10:42:43|12.03.2019 10:57:43|||13.03.2019 09:57:00|
2904|9812|13-41353869|flm|PersonaS 77|м. Черкаси, пр. Хіміків, 76|Черкаси|Черкаська|Черкаське хімволокно|Принтер чековий|Необхідно перевірити роботу чекового принтера. Поточний стан: пристрій несправний. M-Status=16. Отримано інформацію від банку: для доступу до АТМ за півгодини до виїзду на АТМ необхідно телефонувати до к.о. Швыдченко Елена 0673266489. Про результат виконання робіт необхідно звітуватися за номером 0673641820.|Просьба передать письмо со списком сотрудников компании Притек,  кто имеет право на доступ к банкомату, от банка, на проходную организации где установлен банкомат. Пока не будет списка обслуживания не будет по вине банка. Будет писаться ложный вызов!!!!!!!!!!!!!!!!!!!!!!!!!!!!!!!!!!!!!!!|Заявка закрита|12.03.2019 11:03:43|12.03.2019 11:18:43|12.03.2019 15:18:00|12.03.2019 16:10:13|12.03.2019 15:18:00|
2905|9951|13-41354242|flm|PersonaS 77|смт. Великий Бичків, вул. Промислова, 39|Великий Бичків|Закарпатська|ДП Великобичківське лісомисливське господарство|Комунікаційне обладнання|Необхідно перевірити мережеве обладнання, зв'язок відсутній. Про результат виконання робіт необхідно звітуватися за номером 0673641820.|АТМ заработал|Заявка відхилена|12.03.2019 13:39:28|12.03.2019 13:54:29|13.03.2019 12:54:00|||
2906|9850|13-41353516|flm|PersonaS 77|м. Новогродівка, вул. Степова, 1 (1-й АТМ)|Новогродівка|Донецька|ГП Селидіввугілля|Диспенсер|Необхідно скинути помилки по диспенсеру, під час техзаїзду інкасації, роботи виконує Кравченко Василь. Про результат виконання робіт необхідно звітуватися за номером 0673641820.|Выполнен сброс ошибок диспенсера. Выполнена контрольная транзакция (снято 100 грн.) АТМ в сервисе.|Заявка закрита|12.03.2019 14:13:54|12.03.2019 14:28:54|13.03.2019 13:28:00|12.03.2019 14:30:17||
2907|4367|13-51991112|flm|SelfServ 6622|м. Харків, вул. Технологічна, 5|Харків|Харківська|ТОВ Хаск|Комунікаційне обладнання|Необхідно перевірити стан мережеве обладнання, постійні втрати звязку. Необхідно перезавантажити МО, АТМ. Про результат виконання робіт необхідно звітуватися за номером 0673641820.|Заявка отклонена|Заявка відхилена|12.03.2019 14:44:45|12.03.2019 14:59:45|13.03.2019 10:59:00|||
2908|9861|13-41353524|flm|PersonaS 77|м. Київ, пров. Красноармійський, 18|Київ|Київська|Київгаз|Комунікаційне обладнання|Необхідно перевірити мережеве обладнання, зв'язок відсутній. Про результат виконання робіт необхідно звітуватися за номером 0673641820.|Заявку отменил координатор.|Заявка відхилена|12.03.2019 16:35:33|12.03.2019 16:50:33|13.03.2019 08:50:00||13.03.2019 08:50:00|
2909|4551|13-45179897|flm|SelfServ 6626|м. Кам'янське, вул. Широка, 99|Кам'янське|Дніпропетровська|АТЗТ завод МЕТИЗ|Принтер чековий|Необхідно перевірити роботу чекового принтера. Поточний стан: пристрій несправний. M-Status=17. Про результат виконання робіт необхідно звітуватися за номером 0673641820.|Заявку отменил координатор.|Заявка відхилена|12.03.2019 17:40:23|12.03.2019 17:55:23|13.03.2019 16:00:00||13.03.2019 16:55:00|
2910|9806|13-41353554|flm|PersonaS 77|м. Новогродівка, вул. 40 років Жовтня, 46|Новогродівка|Донецька|Магазин Росія|Комунікаційне обладнання|Необхідно провести діагностику АТМ для виявлення причини не підняття його у сервіс. За індикацією хоста - банкомат у режимі обслуговування, фактично - на екрані тимчасова перерва у роботі. Перед виїздом необхідно обовязково звязатись з банкоматним відділом - тел. 044 230 13 26|По приезду обнаружено, что АТМ включен, но в режим супервизор не переводится. Перезагрузка АТМ и коммуникационного оборудования по питанию. После загрузки в системе не виден картридер. Необходима ремонтная заявка на замену картридера (уже создана).|Заявка закрита|12.03.2019 17:58:48|12.03.2019 18:13:49|13.03.2019 17:00:00|14.03.2019 11:00:51|14.03.2019 17:00:00|
2911|4080|13-52671493|flm|SelfServ 6626|м. Стрий, пр. Шевченка, 71А (2-й АТМ)|Стрий|Львівська|Відділення Стрийське|Принтер чековий|Необхідна заміна паперу чекового принтера. Про результат виконання робіт необхідно звітуватися за номером 0673641820.|Проведено заміну паперу скидання помилок та тестування АТМ.|Заявка закрита|12.03.2019 18:47:57|12.03.2019 19:02:57|13.03.2019 15:02:00|13.03.2019 12:30:09|13.03.2019 15:02:00|
