Id заявки|Id банкомата|SN банкомата|Тип|Модель|Адреса|Місто|Область|Розташування|Локалізація|Опис заявки|Звіт|Стан заявки|Час створення|Час доступа|Плановий час|Фактичний час|
3008|4334|13-45181314|flm|SelfServ 6626|м. Черкаси, вул. Чигиринська 13|Черкаси|Черкаська|Верес|Монітор користувацький|Необхідно перевірити роботу АТМ, не завантажується ОС. На екрані System Freeze. Про результат виконання робіт необхідно звітуватися за номером 0673641820.|Ложный вызов. Охрана к банкомату не пустила мотивируя тем, что списка сотрудников с правом доступа у них нет, и они впускают в помещение только инкасаторов и то до 16:30. Необходимо подать на охрану списки сотрудников, имеющих право доступа к АТМ и уточнить корректное время доступа. По System Freeze в системе отсутствует энкриптор, необходима диагностика с системного блока. По результатам отчитался на мониторинг по указанному номеру телефона.|Заявка закрита|22.03.2019 13:14:54|22.03.2019 13:29:54|22.03.2019 17:29:00|22.03.2019 17:05:47|22.03.2019 17:29:00|
3009|4561|13-45179974|flm|SelfServ 6626|м. Чернігів, пр. Миру, 44|Чернігів|Чернігівська|3-я міська поліклініка|Принтер чековий|Необхідно перевірити роботу чекового принтера. Поточний стан: пристрій несправний. M-Status=17. Про результат виконання робіт необхідно звітуватися за номером 0673641820.|Чистка датчиков чекового принтера, тестирование.|Заявка закрита|22.03.2019 13:44:21|22.03.2019 13:59:21|22.03.2019 17:59:00|22.03.2019 18:35:58|22.03.2019 17:59:00|
3010|4644|13-46071489|flm|SelfServ 6622|м. Буча, вул. Енергетиків, 12|Буча|Київська|Бучанська міська рада|Комунікаційне обладнання|Необхідно перевірити мережеве обладнання, зв'язок відсутній. Про результат виконання робіт необхідно звітуватися за номером 0673641820.|АТМ заработал|Заявка відхилена|22.03.2019 15:36:41|22.03.2019 15:51:41|23.03.2019 11:51:00|||
3011|4272|13-45181297|flm|SelfServ 6626|м. Новоград-Волинський, вул. Житомирське шосе, 4|Новоград-Волинський|Житомирська|Магазин Промінь|Комунікаційне обладнання|Необхідно провести забір мережевого обладнання РК. АТМ будк розвантажено для демонтажу 25.03.2019. Про результат виконання робіт необхідно звітуватися за номером 0673641820.|С ATM демонтировано ком.оборудование. Реноме сообщили.|Заявка закрита|22.03.2019 15:38:09|25.03.2019 09:00:00|25.03.2019 17:00:00|25.03.2019 16:50:46|25.03.2019 17:00:00|
3012|9859|13-41353526|flm|PersonaS 77|м. Київ, вул. Червонопрапорна, 34|Київ|Київська|ПАТ Корчуватський комбінат будівельних матеріалів|Принтер чековий|Необхідна заміна паперу чекового принтера. Про результат виконання робіт необхідно звітуватися за номером 0673641820.|Ложный вызов, бумага поменяна.|Заявка закрита|22.03.2019 15:57:02|22.03.2019 16:12:02|23.03.2019 08:12:00|23.03.2019 14:00:15|23.03.2019 08:12:00|
3013|9825|13-41353513|flm|PersonaS 77|м. Київ, пр. Соборності, 1 (3-й АТМ)|Київ|Київська|Відділення Київське №31|Принтер чековий|Необхідна заміна паперу чекового принтера. Про результат виконання робіт необхідно звітуватися за номером 0673641820.|Замена бумаги.|Заявка закрита|22.03.2019 16:44:44|25.03.2019 09:00:00|25.03.2019 13:00:00|25.03.2019 11:00:03|25.03.2019 13:00:00|
3014|9976|13-41376410|flm|PersonaS 77|м. Вінниця, вул. Соборна,10|Вінниця|Вінницька|Укртелеком|Принтер чековий|Необхідно перевірити роботу чекового принтера. Поточний стан: пристрій несправний. M-Status=17. Про результат виконання робіт необхідно звітуватися за номером 0673641820.|Заявку отменили (работники банка).|Заявка відхилена|22.03.2019 18:15:42|22.03.2019 18:30:42|25.03.2019 13:00:00|||
3015|4382|13-45179964|flm|SelfServ 6626|м. Кам'янське, вул. Мурахтова, 4|Кам'янське|Дніпропетровська|Відділення|Принтер чековий|Необхідно перевірити роботу чекового принтера. Поточний стан: пристрій несправний. M-Status=17. Про результат виконання робіт необхідно звітуватися за номером 0673641820.|Заявку отменил координатор. fflm_alfa@renome.rovno.ua Сб 23.03.2019 9:09|Заявка відхилена|22.03.2019 18:24:15|25.03.2019 09:00:00|25.03.2019 17:00:00||25.03.2019 17:00:00|
3016|4247|13-45179805|flm|SelfServ 6626|м. Трускавець, вул. Мазепи, 2|Трускавець|Львівська|Відділення Трускавецьке|Комунікаційне обладнання|Необхідно перевірити мережеве обладнання, зв'язок відсутній. Про результат виконання робіт необхідно звітуватися за номером 0673641820.|Заявку отменил координатор. flm_alfa@renome.rovno.ua Сб 23.03.2019 16:05|Заявка відхилена|23.03.2019 08:57:46|25.03.2019 09:00:00|25.03.2019 17:00:00||25.03.2019 17:00:00|
3017|4419|13-51991102|atm repair|SelfServ 6622|м. Харків, вул. 23 Серпня, 33А|Харків|Харківська|с/м Класс|Диспенсер|ПОВТОРНО. Необхідно відновити роботу диспенсера. M-Status=12. 15.03.2019 ремонт з даною помилкаю вже виконувався  Логи у вкладені. Банкомат розвантажений. Про результат виконання робіт необхідно звітуватися за номером 0673641820.|Установлен на место," кем-то" выломанный, датчик SEN-2. Проведен сброс ошибки, тестирование. Сбоев и ошибок нет. Банкомат готов к загрузке. В случае повторения, данной ситуации, будет составлен акт вандализма со стороны инкасации, все дальнейшие работы по данной проблеме, будут выполняться только после гарантий о дополнительной оплате со стороны банка.|Заявка закрита|23.03.2019 09:57:47|25.03.2019 09:00:00|25.03.2019 17:00:00|23.03.2019 18:00:04|25.03.2019 17:00:00|
3018|9820|13-41376391|flm|PersonaS 77|м. Селидове, вул. Карла Маркса, 10|Селидове|Донецька|Відділення Селидове|Комунікаційне обладнання|Необхідно перевірити мережеве обладнання, зв'язок відсутній. Про результат виконання робіт необхідно звітуватися за номером 0673641820.|Проблемы с локальной сетью банка (после пропадания эл. питания). АТМ подключен к сети банка. Банк занимается данной проблемой. Если после восстановления работы локальной сети АТМ не выйдет в сервис будет создана новая заявка. Про результат виконання робіт  звітовано за номером 0673641820.|Заявка закрита|23.03.2019 10:09:46|25.03.2019 09:00:00|25.03.2019 17:00:00|25.03.2019 09:50:25|25.03.2019 17:00:00|
3019|4571|13-45179876|flm|SelfServ 6626|м. Шостка, вул. Садовий бульвар, 18А|Шостка|Сумська|Приміщення Центрального універмагу|Принтер чековий|Необхідно перевірити роботу чекового принтера. Поточний стан: пристрій несправний. M-Status=17. Про результат виконання робіт необхідно звітуватися за номером 0673641820.|АТМ заработал|Заявка відхилена|23.03.2019 12:08:26|25.03.2019 09:00:00|25.03.2019 17:00:00||25.03.2019 17:00:00|
3020|4113|13-45179961|flm|SelfServ 6626|м. Харків, пр. Науки, 12 (2-й АТМ)|Харків|Харківська|Відділення Харківське №7|Принтер чековий|Необхідна заміна паперу чекового принтера. Про результат виконання робіт необхідно звітуватися за номером 0673641820.|Установлен новый рулон бумаги.|Заявка закрита|23.03.2019 15:18:22|25.03.2019 09:00:00|25.03.2019 13:00:00|25.03.2019 09:40:20|25.03.2019 13:00:00|
3021|4155|13-45179967|flm|SelfServ 6626|м. Дружківка, вул. Соборна, 24|Дружківка|Донецька|Відділення Дружківське|Принтер чековий|Необхідна заміна паперу чекового принтера. Про результат виконання робіт необхідно звітуватися за номером 0673641820.|Замена бумаги. Сброс ошибок по принтеру. Тестирование. АТМ поднят.|Заявка закрита|24.03.2019 11:14:03|25.03.2019 09:00:03|25.03.2019 17:00:00|25.03.2019 10:15:55|25.03.2019 17:00:00|
3022|4381|13-45167159|atm repair|SelfServ 6622|с. Яснозір'я, вул. Центральна, 82|Яснозір'я|Черкаська|ТОВ Верес|Диспенсер|Необхідно відновити роботу диспенсера. M-Status=12. Інкасація повідомила, що не проходить тест злистування. Логи у вкладені. Банкомат розвантажений. Про результат виконання робіт необхідно звітуватися за номером 0673641820.|Окончательно порвались ремни ЛВДТ. Заменил презентер, переставил фиксатор реджекта, протестировал на выдачу со всех модулей по 40 шт. ATM рекомендуется переобучить. По результатам отзвонился координатору. Замененный модуль сразу отправил в Киев.|Заявка закрита|24.03.2019 11:19:50|25.03.2019 09:00:50|26.03.2019 12:00:00|26.03.2019 13:10:51|26.03.2019 12:00:00|
3023|4434|13-49011424|flm|SelfServ 6622|м. Київ, вул. Дегтярівська, 21Г|Київ|Київська|Бізнес-центр|Принтер чековий|Необхідна заміна паперу чекового принтера. Про результат виконання робіт необхідно звітуватися за номером 0673641820.|Замена бумаги принтера.|Заявка закрита|24.03.2019 12:14:10|24.03.2019 12:29:10|24.03.2019 16:29:00|25.03.2019 11:55:42|24.03.2019 16:29:00|
3024|4113|13-45179961|flm|SelfServ 6626|м. Харків, пр. Науки, 12 (2-й АТМ)|Харків|Харківська|Відділення Харківське №7|Кардрідер|Необхідно перевірити роботу кардрідера. Поточний стан: пристрій несправний. M-Status=16, 11, 9. Логи у вкладенні. Про результат виконання робіт необхідно звітуватися за номером 0673641820.|FLM не помог. Чистка картридера чистящей картой. Ошибка не сбрасывается. Требуется заявка на ремонт картридера.|Заявка закрита|25.03.2019 08:42:36|25.03.2019 09:00:00|25.03.2019 13:00:00|25.03.2019 10:00:33|25.03.2019 13:00:00|
3025|4420|13-45181323|flm|SelfServ 6626|м. Київ, вул. Преображенська, 5/2|Київ|Київська|Інститут Будівельних конструкцій|Системний блок|Небхідно відновити роботу АТМ, не завантажується ОС, необхідний ремонт системного блоку. АТМ розвантажено. Про результат виконання робіт необхідно звітуватися за номером 0673641820.|Заявку отменил координатор. (Некорректная заявка, подана на ремонт)|Заявка відхилена|25.03.2019 09:30:01|25.03.2019 09:45:01|25.03.2019 13:45:00|||
3026|4420|13-45181323|atm repair|SelfServ 6626|м. Київ, вул. Преображенська, 5/2|Київ|Київська|Інститут Будівельних конструкцій|Системний блок|Небхідно відновити роботу АТМ, не завантажується ОС, необхідний ремонт системного блоку. АТМ розвантажено. Про результат виконання робіт необхідно звітуватися за номером 0673641820.|Замена винчестера. Переинсталляция программного обеспечения. Необходимо обучить.|Заявка закрита|25.03.2019 09:35:34|25.03.2019 09:50:34|25.03.2019 17:50:00|25.03.2019 14:15:31|25.03.2019 17:50:00|
3027|4334|13-45181314|flm|SelfServ 6626|м. Черкаси, вул. Чигиринська 13|Черкаси|Черкаська|Верес|Монітор користувацький|Необхідно перевірити роботу АТМ, не завантажується ОС. На екрані System Freeze.Отримано інформацію від банку:Списки инженеров будут переданы на охрану сегодня, ответственный от Банка Белоус Александр, моб (067)248-06-64. Перед выездом инженера необходимо созвониться с Белоус Александром для подтверждения предоставления доступа. Про результат виконання робіт необхідно звітуватися за номером 0673641820.|Ложный вызов! Нет доступа к АТМ. Охрана предприятия снова не пустила на АТМ. Отзвонился в Реноме|Заявка закрита|25.03.2019 09:52:16|25.03.2019 10:07:16|25.03.2019 14:07:00|25.03.2019 12:30:00|25.03.2019 14:07:00|
3028|4419|13-51991102|flm|SelfServ 6622|м. Харків, вул. 23 Серпня, 33А|Харків|Харківська|с/м Класс|Принтер чековий|Необхідна заміна паперу чекового принтера. Про результат виконання робіт необхідно звітуватися за номером 0673641820.|Установлен новый рулон бумаги.|Заявка закрита|25.03.2019 11:12:03|25.03.2019 11:27:03|25.03.2019 15:27:00|25.03.2019 13:20:39|25.03.2019 15:27:00|
3029|4358|13-49011432|flm|SelfServ 6622|с. Єлизаветівка, вул. Індустріальна, 9А|Єлизаветівка|Дніпропетровська|Завод Мега Пак|Принтер чековий|Необхідна заміна паперу чекового принтера. Про результат виконання робіт необхідно звітуватися за номером 0673641820.|Установка нового рулона бумаги, сброс ошибки, тестирование. Принтер работает в штатном режиме.|Заявка закрита|25.03.2019 12:27:40|25.03.2019 12:42:40|26.03.2019 10:42:00|25.03.2019 14:05:29||
3030|4334|13-45181314|flm|SelfServ 6626|м. Черкаси, вул. Чигиринська 13|Черкаси|Черкаська|Верес|Системний блок|Необхідно перевірити роботу АТМ, не завантажується ОС. На екрані System Freeze Виїзд буде виконано сумісно з працівником банку Орисенко А. 0675379153|В присутствии сотрудника банка еще 10 мин. получал доступ. Загрузился под инженерным профилем, диагностика. Нестабильно работает программное обеспечение, после запуска SysApp система блокирует диагностику устройств. При штатном запуске АТМ после загрузки сразу перезагружается. Необходима разгрузка АТМ и подача заявки на переустановку операционной системы и ПО. По результатам работ отчитался по указанному телефону.|Заявка закрита|25.03.2019 12:40:35|25.03.2019 13:10:00|25.03.2019 17:10:00|25.03.2019 14:50:38|25.03.2019 17:10:00|
3031|9948|13-41376383|atm repair|PersonaS 77|м. Луцьк, пр. Волі, 7 (3-й АТМ)|Луцьк|Волинська|Відділення Луцьке|Системний блок|Необхідно провести ремонт системного блоку. Згідно повідомлення інженера необхідна заміна материнської плати. Про результат виконання робіт необхідно звітуватися за номером 0673641820.|Ремонт системного блока. Заменил материнскую плату PIVAT (неисправная отправлена в ремонт).  Установлена : ОС - Windows XP, приложение - AANDC 2.66-25. Изменен пароль на BIOS и порядок загрузки ОС. При тестировании ошибок в работе АТМ не выявлено. Установлены параметры используемых купюр. Сообщил инициатору заявки о завершении работы.|Заявка закрита|25.03.2019 13:17:43|25.03.2019 13:32:43|26.03.2019 12:32:00|26.03.2019 12:20:56|26.03.2019 12:32:00|
3032|4113|13-45179961|atm repair|SelfServ 6626|м. Харків, пр. Науки, 12 (2-й АТМ)|Харків|Харківська|Відділення Харківське №7|Кардрідер|Необхідно виконати заміну роликів зчитувача. роботи фактично виконані|Произведена разборка и чистка картридера. Замена переднего и среднего (узкие) транспортных роликов. Тестирование чиповыми и магнитными картами.  Сбоев и ошибок нет. АТМ поднят в сервис.|Заявка закрита|25.03.2019 14:13:23|25.03.2019 14:28:23|26.03.2019 13:28:00|25.03.2019 12:00:22||
3033|4677|13-45179908|flm|SelfServ 6622|м. Київ, пр. Степана Бандери, 23А|Київ|Київська|Магазин Сітi Ком ТЦ Городок|Комунікаційне обладнання|Необхідно перевірити мережеве обладнання, зв'язок відсутній. На місці перезавантажити АТМ по живленню. Про результат виконання робіт необхідно звітуватися за номером 0673641820.|Ложный вызов.  При подъезде АТМ работал и проводил транзакции. По просьбе Реноме произведена перезагрузка ком оборудования и АТМ.|Заявка закрита|25.03.2019 15:41:22|25.03.2019 15:56:23|25.03.2019 19:56:00|26.03.2019 16:45:47|25.03.2019 19:56:00|
3034|4411|13-45179916|flm|SelfServ 6622|м. Запоріжжя, вул. Сталеварів, 31А|Запоріжжя|Запорізька|Відділення Медичне|Кардрідер|Необхідно перевірити роботу кардрідера. Отрили звернення від банку, що картка не повінстю виїжджає клієнту. Про результат виконання робіт необхідно звітуватися за номером 0673641820.|Картридер работает в нормальном режиме. Карточка выезжает нормально. Проблем нет.|Заявка закрита|25.03.2019 15:46:16|25.03.2019 16:01:17|26.03.2019 08:01:00|25.03.2019 17:25:46||
3035|9820|13-41376391|atm repair|PersonaS 77|м. Селидове, вул. Карла Маркса, 10|Селидове|Донецька|Відділення Селидове|Системний блок|Необхідно провести ремонт системного блоку, інформація отримана від інженера. Про результат виконання робіт необхідно звітуватися за номером 0673641820.|В результате скачков и отключений эл. снабжения в помещении отделения, где расположен АТМ, вышла из строя сетевая карта (интегрированная в motherboard). АКТ отправлен адрессатам.|Заявка закрита|25.03.2019 16:15:01|25.03.2019 16:30:01|27.03.2019 10:30:00|25.03.2019 15:50:39|27.03.2019 10:30:00|
3036|4147|13-45181320|flm|SelfServ 6626|м. Чернігів, вул. Івана Мазепи, 33|Чернігів|Чернігівська|Магазин Харків-Електро|Принтер чековий|Необхідно перевірити роботу чекового принтера. Поточний стан: пристрій несправний. Постійно повторюється помилка M-Status=17.  Про результат виконання робіт необхідно звітуватися за номером 0673641820.|Извлечение застрявшего чека, тестирование.|Заявка закрита|26.03.2019 07:56:57|26.03.2019 09:00:00|26.03.2019 13:00:00|26.03.2019 10:00:00|26.03.2019 13:00:00|
3037|4412|13-45181311|flm|SelfServ 6622|м. Полтава, пр. Першотравневий, 27|Полтава|Полтавська|Гуртожиток № 4 ПНТУ ім.Ю.Кондратюка|Принтер чековий|Необхідно перевірити роботу чекового принтера. Поточний стан: пристрій несправний. Постійно повторюється помилка M-Status=17, логи у вкладенні. Про результат виконання робіт необхідно звітуватися за номером 0673641820.|Чистка чекового принтера. Тест. АТМ в сервисе.|Заявка закрита|26.03.2019 09:20:25|26.03.2019 09:35:25|26.03.2019 13:35:00|27.03.2019 12:20:00|26.03.2019 13:35:00|
